<Payload xmlns="http://javaops.ru"
         xmlns:xsi="http://www.w3.org/2001/XMLSchema-instance"
         xsi:schemaLocation="http://javaops.ru payload_new.xsd">

    <Cities>
        <City id="spb">Санкт-Петербург</City>
        <City id="kiv">Киев</City>
        <City id="mnsk">Минск</City>
    </Cities>
    <Projects>
        <Project name="topjava">
            <Description>Описание проекта: topjava</Description>
            <Group name="topjava06" type="FINISHED"/>
            <Group name="topjava07" type="FINISHED"/>
            <Group name="topjava08" type="CURRENT"/>
        </Project>
        <Project name="masterjava">
            <Description>Описание проекта masterjava</Description>
            <Group name="masterjava01" type="CURRENT"/>
        </Project>
    </Projects>
    <Users>
        <User flag="active" city="kiv" email="admin@javaops.ru" groupRefs="topjava06  topjava07 topjava08">Full Name
        </User>
        <User flag="superuser" city="spb" email="admin@javaops.ru" groupRefs="topjava08">Admin</User>
        <User flag="deleted" city="spb" email="mail@yandex.ru" groupRefs="masterjava01">Deleted</User>
    </Users>
</Payload>